{"version":"hsm-conformance-v1","name":"submodel_root_exit_point_handler_effect_set_attr_generated_trigger_after_child_handler_target_resolution","description":"Attribute work from a child-model root-owned exit-point handler effect replays only after the child handler target reaches its nested leaf.","features":["submachine","exit_point","source","attribute","on_set","when","effect","nested","queue","reentrancy"],"model":{"name":"SubmodelRootExitPointHandlerEffectSetAttrGeneratedTriggerAfterChildHandlerTargetResolution","initial":"drive","states":[{"name":"drive","kind":"submachine","machine":"ChildRootExitPointHandlerEffectSetAttrReplay"}]},"models":[{"name":"NestedRootHandlerSetAttrChild","initial":"active","exit_points":[{"name":"done"}],"states":[{"name":"active","transitions":[{"on":"finish","target":"done"}]}]},{"name":"ChildRootExitPointHandlerEffectSetAttrReplay","initial":"nested","attributes":{"flag":{"type":"boolean","default":false},"ready":{"type":"boolean","default":false}},"states":[{"name":"nested","kind":"submachine","machine":"NestedRootHandlerSetAttrChild"},{"name":"parent","initial":"child","entry":[{"behavior":"entry_parent"}],"transitions":[{"trigger":{"kind":"on_set","attribute":"flag"},"target":"wrong","effects":[{"behavior":"effect_wrong"}]}],"states":[{"name":"child","entry":[{"behavior":"entry_child"}],"transitions":[{"trigger":{"kind":"on_set","attribute":"flag"},"target":"../flag_seen","effects":[{"behavior":"effect_flag"}]}]},{"name":"flag_seen","entry":[{"behavior":"entry_flag"}],"transitions":[{"trigger":{"kind":"when","behavior":"ready_when"},"target":"../all_seen","effects":[{"behavior":"effect_ready"}]}]},{"name":"all_seen","entry":[{"behavior":"entry_all"}]}]},{"name":"wrong"}],"transitions":[{"source":"nested","trigger":{"kind":"exit_point","exit_point":"done"},"target":"parent","effects":[{"behavior":"handler_set"}]}]}],"behaviors":{"handler_set":[{"op":"set_attr","name":"flag","value":true},{"op":"set_attr","name":"ready","value":true},{"op":"trace","value":"effect:handler"}],"ready_when":[{"op":"return_equals","name":"ready","value":true}],"entry_parent":[{"op":"trace","value":"entry:parent"}],"entry_child":[{"op":"trace","value":"entry:child"}],"effect_flag":[{"op":"trace","value":"effect:flag"}],"entry_flag":[{"op":"trace","value":"entry:flag"}],"effect_ready":[{"op":"trace","value":"effect:ready"}],"entry_all":[{"op":"trace","value":"entry:all"}],"effect_wrong":[{"op":"trace","value":"effect:wrong"}]},"script":[{"op":"start"},{"op":"dispatch","event":"finish"}],"expect":{"state":"/SubmodelRootExitPointHandlerEffectSetAttrGeneratedTriggerAfterChildHandlerTargetResolution/drive/parent/all_seen","attributes":{"flag":true,"ready":true},"trace":[{"type":"dispatch","event":"finish"},{"type":"trace","value":"effect:handler"},{"type":"trace","value":"entry:parent"},{"type":"trace","value":"entry:child"},{"type":"trace","value":"effect:flag"},{"type":"trace","value":"entry:flag"},{"type":"trace","value":"effect:ready"},{"type":"trace","value":"entry:all"},{"type":"stable","state":"/SubmodelRootExitPointHandlerEffectSetAttrGeneratedTriggerAfterChildHandlerTargetResolution/drive/parent/all_seen"}]}}