{"version":"hsm-conformance-v1","name":"timer_after_effect_raise_reentrancy","description":"A normal internal event raised from an after timer effect is processed after the timer transition target is entered.","features":["timer","after","queue","reentrancy"],"model":{"name":"TimerAfterEffectRaiseReentrancy","initial":"waiting","states":[{"name":"waiting","transitions":[{"trigger":{"kind":"after","duration_ms":10},"target":"fired","effects":[{"behavior":"timer_raise"}]}]},{"name":"fired","entry":[{"behavior":"entry_fired"}],"transitions":[{"on":"audit","target":"audited","effects":[{"behavior":"effect_audit"}]}]},{"name":"audited"}]},"behaviors":{"timer_raise":[{"op":"raise","event":"audit"},{"op":"trace","value":"effect:timer"}],"entry_fired":[{"op":"trace","value":"entry:fired"}],"effect_audit":[{"op":"trace","value":"effect:audit"}]},"script":[{"op":"start"},{"op":"tick","millis":100}],"expect":{"state":"/TimerAfterEffectRaiseReentrancy/audited","trace":[{"type":"timer_scheduled"},{"type":"timer_fired"},{"type":"raise","event":"audit"},{"type":"trace","value":"effect:timer"},{"type":"trace","value":"entry:fired"},{"type":"trace","value":"effect:audit"},{"type":"stable","state":"/TimerAfterEffectRaiseReentrancy/audited"}]}}
