{"version":"hsm-conformance-v1","name":"nested_completion_guard_set_attr_generated_trigger_after_nested_completion_target_entry","description":"Attribute work generated from a nested completion transition guard replays only after the nested completion target reaches its leaf.","features":["completion","final","attribute","on_set","when","guard","nested","queue","reentrancy"],"model":{"name":"NestedCompletionGuardSetAttrGeneratedTriggerAfterNestedCompletionTargetEntry","initial":"comp","attributes":{"flag":{"type":"boolean","default":false},"ready":{"type":"boolean","default":false}},"states":[{"name":"comp","initial":"work","states":[{"name":"work","transitions":[{"on":"finish","target":"../done"}]},{"name":"done","kind":"final"}],"transitions":[{"trigger":{"kind":"completion"},"target":"../parent","guard":{"behavior":"completion_guard"}}]},{"name":"parent","initial":"child","entry":[{"behavior":"entry_parent"}],"transitions":[{"trigger":{"kind":"on_set","attribute":"flag"},"target":"wrong","effects":[{"behavior":"effect_wrong"}]}],"states":[{"name":"child","entry":[{"behavior":"entry_child"}],"transitions":[{"trigger":{"kind":"on_set","attribute":"flag"},"target":"../flag_seen","effects":[{"behavior":"effect_flag"}]}]},{"name":"flag_seen","entry":[{"behavior":"entry_flag"}],"transitions":[{"trigger":{"kind":"when","behavior":"ready_when"},"target":"../all_seen","effects":[{"behavior":"effect_ready"}]}]},{"name":"all_seen","entry":[{"behavior":"entry_all"}]}]},{"name":"wrong"}]},"behaviors":{"completion_guard":[{"op":"set_attr","name":"flag","value":true},{"op":"set_attr","name":"ready","value":true},{"op":"trace","value":"guard:true"},{"op":"return_value","value":true}],"ready_when":[{"op":"return_equals","name":"ready","value":true}],"entry_parent":[{"op":"trace","value":"entry:parent"}],"entry_child":[{"op":"trace","value":"entry:child"}],"effect_flag":[{"op":"trace","value":"effect:flag"}],"entry_flag":[{"op":"trace","value":"entry:flag"}],"effect_ready":[{"op":"trace","value":"effect:ready"}],"entry_all":[{"op":"trace","value":"entry:all"}],"effect_wrong":[{"op":"trace","value":"effect:wrong"}]},"script":[{"op":"start"},{"op":"dispatch","event":"finish"}],"expect":{"state":"/NestedCompletionGuardSetAttrGeneratedTriggerAfterNestedCompletionTargetEntry/parent/all_seen","attributes":{"flag":true,"ready":true},"trace":[{"type":"dispatch","event":"finish"},{"type":"trace","value":"guard:true"},{"type":"trace","value":"entry:parent"},{"type":"trace","value":"entry:child"},{"type":"trace","value":"effect:flag"},{"type":"trace","value":"entry:flag"},{"type":"trace","value":"effect:ready"},{"type":"trace","value":"entry:all"},{"type":"stable","state":"/NestedCompletionGuardSetAttrGeneratedTriggerAfterNestedCompletionTargetEntry/parent/all_seen"}]}}
