{"version":"hsm-conformance-v1","name":"submodel_completion_guard_and_effect_set_attr_generated_trigger_replay","description":"Attribute work from child-model completion guard and effect behavior replays only after the completion target is active.","features":["submachine","completion","final","attribute","guard","effect","on_set","when","queue"],"model":{"name":"SubmodelCompletionGuardAndEffectSetAttrGeneratedTriggerReplay","initial":"drive","states":[{"name":"drive","kind":"submachine","machine":"ChildCompletionSetAttrReplay"}]},"models":[{"name":"ChildCompletionSetAttrReplay","initial":"work","attributes":{"flag":{"type":"boolean","default":false},"ready":{"type":"boolean","default":false}},"states":[{"name":"work","transitions":[{"on":"finish","target":"done"}]},{"name":"done","kind":"final"},{"name":"target","transitions":[{"trigger":{"kind":"on_set","attribute":"flag"},"target":"flag_seen","effects":[{"behavior":"effect_flag"}]}]},{"name":"flag_seen","transitions":[{"trigger":{"kind":"when","behavior":"ready_when"},"target":"all_seen","effects":[{"behavior":"effect_ready"}]}]},{"name":"all_seen"}],"transitions":[{"trigger":{"kind":"completion"},"guard":{"behavior":"guard_set"},"target":"target","effects":[{"behavior":"effect_set"}]}]}],"behaviors":{"guard_set":[{"op":"set_attr","name":"flag","value":true},{"op":"trace","value":"guard:set"},{"op":"return_value","value":true}],"effect_set":[{"op":"set_attr","name":"ready","value":true},{"op":"trace","value":"effect:set"}],"ready_when":[{"op":"return_equals","name":"ready","value":true}],"effect_flag":[{"op":"trace","value":"effect:flag"}],"effect_ready":[{"op":"trace","value":"effect:ready"}]},"script":[{"op":"start"},{"op":"dispatch","event":"finish"}],"expect":{"state":"/SubmodelCompletionGuardAndEffectSetAttrGeneratedTriggerReplay/drive/ChildCompletionSetAttrReplay/all_seen","attributes":{"flag":true,"ready":true},"trace":[{"type":"dispatch","event":"finish"},{"type":"trace","value":"guard:set"},{"type":"trace","value":"effect:set"},{"type":"trace","value":"effect:flag"},{"type":"trace","value":"effect:ready"},{"type":"stable","state":"/SubmodelCompletionGuardAndEffectSetAttrGeneratedTriggerReplay/drive/ChildCompletionSetAttrReplay/all_seen"}]}}