{"version":"hsm-conformance-v1","name":"submodel_root_transition_false_guard_all_ops_fallback_replays","description":"A child-model root-owned false guard can enqueue behavior work before a child-root fallback target receives it under the submachine boundary.","features":["submachine","root_transition","guard","snapshot","operation","on_call","queue","reentrancy","selection_order"],"model":{"name":"SubmodelRootTransitionFalseGuardAllOpsFallbackReplays","initial":"drive","states":[{"name":"drive","kind":"submachine","machine":"ChildRootFalseGuardOps"},{"name":"outside"}]},"models":[{"name":"ChildRootFalseGuardOps","initial":"idle","operations":{"audit_call":{"behavior":"operation_audit"}},"states":[{"name":"idle"},{"name":"waiting","entry":[{"behavior":"entry_waiting"}],"transitions":[{"on":"audit_dispatch","target":"dispatch_seen","effects":[{"behavior":"effect_dispatch"}]},{"on":"audit_raise","target":"raise_seen","effects":[{"behavior":"effect_raise"}]},{"trigger":{"kind":"on_call","operation":"audit_call"},"target":"call_seen","effects":[{"behavior":"effect_call"}]}]},{"name":"dispatch_seen","transitions":[{"on":"audit_raise","target":"raise_seen","effects":[{"behavior":"effect_raise"}]}]},{"name":"raise_seen","transitions":[{"trigger":{"kind":"on_call","operation":"audit_call"},"target":"all_seen","effects":[{"behavior":"effect_call"}]}]},{"name":"call_seen"},{"name":"all_seen"},{"name":"wrong"}],"transitions":[{"on":"go","guard":{"behavior":"guard_false_all"},"target":"wrong"},{"on":"go","target":"waiting","effects":[{"behavior":"effect_fallback"}]}]}],"behaviors":{"operation_audit":[{"op":"trace","value":"operation:audit"}],"guard_false_all":[{"op":"snapshot"},{"op":"dispatch","event":"audit_dispatch"},{"op":"raise","event":"audit_raise"},{"op":"call","name":"audit_call"},{"op":"return_value","value":false}],"effect_fallback":[{"op":"trace","value":"effect:fallback"}],"entry_waiting":[{"op":"trace","value":"entry:waiting"}],"effect_dispatch":[{"op":"trace","value":"effect:dispatch"}],"effect_raise":[{"op":"trace","value":"effect:raise"}],"effect_call":[{"op":"trace","value":"effect:call"}]},"script":[{"op":"start"},{"op":"dispatch","event":"go"}],"expect":{"state":"/SubmodelRootTransitionFalseGuardAllOpsFallbackReplays/drive/ChildRootFalseGuardOps/all_seen","trace":[{"type":"dispatch","event":"go"},{"type":"snapshot","state":"/SubmodelRootTransitionFalseGuardAllOpsFallbackReplays/drive/ChildRootFalseGuardOps/idle"},{"type":"dispatch","event":"audit_dispatch"},{"type":"raise","event":"audit_raise"},{"type":"trace","value":"operation:audit"},{"type":"trace","value":"effect:fallback"},{"type":"trace","value":"entry:waiting"},{"type":"trace","value":"effect:dispatch"},{"type":"trace","value":"effect:raise"},{"type":"trace","value":"effect:call"},{"type":"stable","state":"/SubmodelRootTransitionFalseGuardAllOpsFallbackReplays/drive/ChildRootFalseGuardOps/all_seen"}]}}